No.,Lims No.,物质名称(英文),物质名称(中文),列入日期,EC 号码,CAS 号码,可能用途,Possible Applications,Natural textiles,Synthetic textiles,Leather,Metal,Plastic|polymers|foam,Wood,Paper,Ceramic,Glass,Dye|Pigment|Ink|Paint,Adhesives|Sealants,Battery,Electronic components,*Remarks,Organic|Inorganic,Chemical Classification
145,145,Cadmium sulphide,硫化镉,12/16/2013,215-147-8,1306-23-6,"用作塑料,玻璃和陶瓷中作為的颜料、也可用于着色合成纺织品玻璃添加剂和光电子应用材料（例如，太阳能电池)","It is used as a pigment in plastic, glass and ceramic. It can be used to colour synthetic textiles. An Additive for production of glass and ingredients of photo-electronic applications (e.g. solar cells).",N,Y,N,N,Y,N,N,Y,N,Y,N,N,Y,,Inorganic,"Cd, S"
146,146,"Disodium 3,3'-[[1,1'-biphenyl]-4,4'-diylbis(azo)]bis(4-aminonaphthalene-1-sulphonate)(C.I. Direct Red 28)",直接红28,12/16/2013,209-358-4,573-58-0,用作纺织品，丝绸，皮革，塑料，纸张当中的染料和pH指示剂,"It is used as a dye for textiles (e.g. wool, silk, leather), plastic, paper and a pH indicator.",Y,Y,Y,N,Y,N,Y,N,N,Y,N,N,N,,Organic,Azo compounds
147,147,"Disodium 4-amino-3-[[4'-[(2,4-diaminophenyl)azo][1,1'-biphenyl]-4-yl]azo] -5-hydroxy-6-(phenylazo)naphthalene-2,7-disulphonate (C.I. Direct Black 38)",直接黑38,12/16/2013,217-710-3,1937-37-7,用作纺织品，丝绸，皮革，塑料，木材，纸张当中的染料和生产水性墨水。,"It is used as a dye for textiles (e.g. wool, silk, leather), plastic, wood, paper and production of aqueous ink.",Y,Y,Y,N,Y,Y,Y,N,N,Y,N,N,N,,Organic,Azo compounds
148,148,Dihexyl phthalate,邻苯二甲酸二己酯,12/16/2013,201-559-5,84-75-3,PVC增塑剂,"It is used as plasticisers in PVC such as toys, gloves, footwear.",N,Y*,N,N,Y,N,N,N,N,N,N,N,N,May be found in textiles with plastisol print  and synthetic leather.,Organic,Phthalates
149,149,Imidazolidine-2-thione (2-imidazoline-2-thiol),"1,2-亚乙基硫脲",12/16/2013,202-506-9,96-45-7,作为硫化聚氯丁二烯（氯丁橡胶）和聚丙烯酸酯橡胶的促进剂,It is used as an accelerator for vulcanizing polychloroprene (neoprene) and polyacrylate rubbers.,N,N,N,N,Y,N,N,N,N,N,N,N,N,,Organic,Imidazoles
150,150,Lead di(acetate),醋酸铅,12/16/2013,206-104-4,301-04-2,作为实验室化学品;在涂料和油漆，涂料，脱漆剂 ,"As a laboratory chemical; used in coatings and paints, thinners, paint remover",N,N,N,N,N,N,N,N,N,Y,N,N,N,,Inorganic,Pb compounds
151,151,Trixylyl phosphate,磷酸二甲酚酯,12/16/2013,246-677-8,25155-23-1,"用于纺织品, 塑料的阻燃剂和功能流体(如润滑剂，金属加工液)",It is used as flame retardants in textile plastic and functional fluid such as lubricants metal working fluid.,Y,Y,N,N,Y,N,N,N,N,N,N,N,N,,Organic,Organophosphate compounds
152,152,"1,2-Benzenedicarboxylic acid, dihexyl ester, branched and linear",邻苯二甲酸二己酯支链与直链,6/16/2014,271-093-5,68515-50-4,用作聚合物的增塑剂，绝缘体，密封材料，机油稳定剂，机动车齿轮的润滑剂,"It is used as plasticisers in polymers, insulating, sealing material, motor oil stabiliser, gear lubricants for motor vehicles.",N,N,N,N,Y,N,N,N,N,N,Y,N,N,,Organic,Phthalates
153,153,Cadmium chloride,氯化镉,6/16/2014,233-296-7,10108-64-2,用作合成其它镉化合物的原材料; 作为中间体用于生产无机颜料和稳定剂; 用于金属涂层的电镀和电镀锌浴; ,It is used as raw materials for synthesis of other cadmium compounds. As intermediate of  production of inorganic pigments and stabilisers. It is also used in electroplating and electrogalvanizing baths for metal coating. ,N,N,N,Y,N,N,N,N,N,Y,N,N,N,,Inorganic,"Cd, Cl"
154,154,"Sodium perborate; perboric acid, sodium salt","过硼酸钠;过硼酸,钠盐",6/16/2014,239-172-9; 234-390-0, - ,用作洗衣清洁剂和机器洗碗产品中的漂白剂,It is used as a bleaching agent in laundry detergents and machine dishwashing products.,Y,Y,N,N,N,N,N,N,N,N,N,N,N,,Inorganic,"B, Na"
155,155,Sodium peroxometaborate,过硼酸钠,6/16/2014,231-556-4,4/4/7632,用作洗衣清洁剂和机器洗碗产品中的漂白剂,It is used as a bleaching agent in laundry detergents and machine dishwashing products.,Y,Y,N,N,N,N,N,N,N,N,N,N,N,,Inorganic,"B, Na"
156,156,Cadmium fluoride,氟化镉,12/17/2014,232-222-0,7790-79-6,用于研究的化学品; 用于发光屏幕; 用于制造玻璃; 电动刷;控制核反应堆; 用作高温干膜的润滑剂; 光学应用;用作激光晶体的原材料; 以前用作铝及其合金焊接助熔剂。,"Used as research chemicals. Used in phosphorus for luminescent screens. Manufacturing of glass, electric brushes, in nuclear reactor control, high-temperature dry-film lubricant, optical applications, starting material for crystals for lacer. Previously used as a fluxing agent in soldering of aluminium and its alloys.",N,N,N,N,N,N,N,N,Y,N,N,N,Y,,Inorganic,"Cd, F"
157,157,Cadmium sulphate,硫酸镉,12/17/2014,233-331-6,"10124-36-4, 31119-53-6",作为中间体用于生产无机镉化合物和用作实验室试剂; 用作金属表面涂层的原料和用于恢复铅酸电池; 其他用途包括用作电镀的电解质，荧光粉，杀线虫剂，航空应用中的干膜润滑剂; 皮革染色剂,"As an intermediate for the production of inorganic cadmium compounds and used as a laboratory reagent.  Used as a raw material for metal surface coating and for restoring of lead acid batteries. Other uses include electrolytes in electroplating, phosphors, nematocides, dry-film lubricant for aeronautic applications. Colouring agent used in leather finishing ",N,N,Y,Y,N,N,N,N,N,Y,N,Y,N,,Inorganic,"Cd, S"
158,158,"2-benzotriazol-2-yl-4,6-di-tert-butylphenol (UV-320)",紫外吸收剂 UV-320,12/17/2014,223-346-6,3846-71-7,于汽车和特殊工业木材中用作涂层的紫外线保护剂; 塑料、橡胶、聚氨酯、带涂层的纺织品和化妆品中的紫外线保护剂,"Used as UV-protection agents and UV-stabilisers in car and special industrial wood coating, plastics, rubber and polyurethanes. Used in cosmetics (e.g. as sun protection agents).",N,N,N,N,Y,N,N,N,N,N,N,N,N,,Organic,Phenolic benzotriazoles
159,159,"2-(2H-benzotriazol-2-yl)-4,6-ditertpentylphenol (UV-328)",紫外吸收剂 UV-328,12/17/2014,247-384-8,25973-55-1,于汽车和特殊工业木材中用作涂层的紫外线保护剂; 塑料、橡胶、聚氨酯、化妆品中的紫外线保护剂  用于塑料和树脂的光稳定剂，如丙烯，PVC，不饱和聚酯，聚丙烯酸酯，聚碳酸酯，ABS树脂，环氧树脂，纤维树脂等; 用于粘合剂,"Used as UV-protection agents in car and special industrial wood coating, plastics, rubber, polyurethanes. Used for light stabilising in plastic and resin e.g. propylene, PVC, unsaturated polyester, polyacrylate, polycarbonate, ABS resin, epoxy resin, fiber resin.etc. Used in adhesives. Used in cosmetics (e.g. as sun protection agents).",N,N,N,N,Y,N,N,N,N,N,Y,N,N,,Organic,Phenolic benzotriazoles
160,160,"2-ethylhexyl 10-ethyl-4,4-dioctyl-7-oxo-8-oxa-3,5-dithia-4-stannatetradecanoate (DOTE)",二正辛基-双（巯乙酸2-乙基己酯）锡,12/17/2014,239-622-4,15571-58-1,PVC稳定剂,Used as a stabiliser for PVC processing.,N,N,N,N,Y,N,N,N,N,N,N,N,N,,Organic,Organotin compounds
161,161,"Reaction mass of 2-ethylhexyl 10-ethyl-4,4-dioctyl-7-oxo-8-oxa-3,5-dithia-4-stannatetradecanoate and 2-ethylhexyl 10-ethyl-4-[[2-[(2-ethylhexyl)oxy]-2-oxoethyl]thio]-4-octyl-7-oxo-8-oxa-3,5-dithia-4-stannatetradecanoate (reaction mass of DOTE and MOTE)",二正辛基-双（巯乙酸2-乙基己酯）锡（DOTE）和三（2-乙基己基巯基乙酸）辛锡（MOTE）的反应产物,12/17/2014,-,-,PVC热稳定剂,"Used as a heat stabiliser in the production of PVC.
",N,N,N,N,Y,N,N,N,N,N,N,N,N,,Organic,Organotin compounds
162,162,"1,2-benzenedicarboxylic acid, di-C6-10-alkyl esters; 1,2-benzenedicarboxylic acid, mixed decyl and hexyl and octyl diesters with ≥ 0.3% of dihexyl phthalate (EC No. 201-559-5)",鄰苯二甲酸二（C6-C6）烷基酯：(癸基，己基，辛基)酯與1，2-鄰苯二甲酸的複合物且鄰苯二甲酸二己酯含量≥ 0.3%,6/15/2015,271-094-0; 272-013-1,68515-51-5; 68648-93-1 ,用于制造物质和PVC化合物。用于涂料，美术用品，建筑材料，润滑剂和粘合剂。用于胶粘剂的聚氨酯产品和挡风玻璃密封胶,"Used in manufacture of substances and PVC compounds. Used in coatings, artist supply, building material, lubricants and adhesives. Used in polyurethane product intended for adhesives and sealants for windshields
",N,N,N,N,Y,N,N,N,N,N,Y,N,N,,Organic,Phthalates
163,163,"5-sec-butyl-2-(2,4-dimethylcyclohex-3-en-1-yl)-5-methyl-1,3-
dioxane [1], 5-sec-butyl-2-(4,6-dimethylcyclohex-3-en-1-yl)-
5-methyl-1,3-dioxane [2] [covering any of the individual
isomers of [1] and [2] or any combination thereof]","[1]為卡拉花醛，[2]為卡拉花醛的一種同分異構化合物, (卡拉花醛及其同分异构体，还包括卡拉花醛和其同分异构体的任意组合）",6/15/2015,-,-,用作香氛,Used as fragrance,N,N,N,N,N,N,N,N,N,N,N,N,N,,Organic,Dioxane compounds
164,164,Nitrobenzene,硝基苯,12/18/2015,202-716-0,98-95-3,"主要用于生产其他的化学物质;
存在于印刷产业的复印试剂;
用于制剂的制备，用作加工助剂及溶剂。","Mainly used for the production of other substances;
Present in reprographic agents in the printing industry;
Used for the preparation of formulations, use as processing aids and use as solvents.
",N,N,N,N,N,N,N,N,N,Y,N,N,N,,Organic,Benzene derivatives
165,165,"2,4-di-tert-butyl-6-(5-chlorobenzotriazol-2-yl)phenol (UV-327)","2-(2‘-羟基-3’,5‘-二叔丁基苯基)-5-氯代苯并三唑 （紫外线吸收剂UV-327） ",12/17/2015,223-383-8,3864-99-1,"用作紫外线保护剂，特别是用于透明塑胶材料；
用作塑胶，橡胶和聚氨酯(PU),以及化妆品中的紫外线保护剂；用作表面涂层（特别是汽车和特殊工业木器涂料）的紫外线保护剂和配方中的成分；
用作橡胶和广泛的塑胶材料及制品中的紫外线稳定剂","Used as UV-absorbers especially for transparent plastic materials;
Used as UV-protection agents for plastics, rubber and polyurethanes, and in cosmetics; used as UV-protection agents and constituent in formulations used for coatings especially for cars and special industrial wood coatings;
Used as UV-stabiliser for rubber and a wide range of plastics and articles。",N,N,N,N,Y,N,N,N,N,Y,N,N,N,,Organic,Phenolic benzotriazoles 
166,166,2-(2H-benzotriazol-2-yl)-4-(tert-butyl)-6-(sec-butyl)phenol (UV-350),2-(2‘-羟基-3’-异丁基-5‘-叔丁基苯基)苯并三唑（紫外线吸收剂UV-350）,12/18/2015,253-037-1,36437-37-3,"用作紫外线保护剂，特别是用于透明塑胶材料；
用作塑胶，橡胶和聚氨酯(PU)中的紫外线保护剂紫外线稳定剂；用作化妆品中的紫外线保护剂；用作表面涂层（特别是汽车和特殊工业木器涂料）的紫外线保护剂和配方中的成分.","Used as UV-absorbers especially for transparent plastic materials;
Used as UV-protection agents and UV- stabiliser for plastics, rubber and polyurethanes; used as UV-protection in cosmetics; used as UV-protection agents and constituent in formulations used for coatings especially for cars and special industrial wood coatings.",N,N,N,N,Y,N,N,N,N,Y,N,N,N,,Organic,Phenolic benzotriazoles 
167,167,"1,3-propanesultone","1,3-丙烷磺内酯 ",12/17/2015,214-317-9,1120-71-4,"用作生产精细和散装化学品的媒介;
用于混合物的配制（包括电解液）;
用于锂离子电池的电解液。","Used as intermediates in the manufacture of fine and bulk chemicals;
Used in the formulation of 
mixtures (including electrolyte);
Used in the electrolyte fluid of lithium ion batteries.",N,N,N,N,N,N,N,N,N,N,N,Y,N,,Organic,Organosulphur compounds
168,168,"Perfluorononan-1-oic acid (2,2,3,3,4,4,5,5,6,6,7,7,8,8,9,9,9-heptadecafluorononanoic acid and its sodium and ammonium salts",全氟壬酸及其钠盐和铵盐 ,12/17/2015,206-801-3,"375-95-1;
21049-39-8;
4149-60-4","用作纺织品的防污处理剂；
存在于户外纺织品，地毯，手套，皮革，蓬布，耐污纺织品（如儿童防风衣，运动服及桌布）；
存在于纸质食品接触材料；
用于液晶显示屏；
用作生产含氟聚合物（尤其是聚偏二氯乙烯）的加工助剂；
用作润滑油的添加剂和灭火设备的表面活性剂，清洁剂，抛光的表面活性剂，防水试剂；
存在于纳米喷雾，浸渍喷雾及滑雪蜡。","Used as textile antifouling finishing agent; 
Present in outdoor textiles, carpet, gloves, leather, awning cloth, stain resistant textiles (such as child storm suits, sport clothes and tablecloth);
Present in paper-based food contact materials;
Used in liquid crystal display panels;
Used as a processing aid for the fluoropolymer manufacture, most notably for polyvinylidene fluoride;
Used as lubricating oil additive, surfactant for fire extinguishers, cleaning agent, polishing surfactant, waterproofing agents;
Present in nanosprays and impregnation sprays and ski waxes.
",Y*,Y*,Y*,N,Y,N,Y,N,N,N,N,N,Y,Textiles and leather: only applicable to those with water/oil/stain repellent finishing,Organic,Perfluorinated compounds
169,170,Benzo[def]chrysene (Benzo[a]pyrene),苯并[a]芘,6/20/2016,200-028-5,50-32-8,"通常不是有意添加和使用，但可能是其他物质的成分或为杂质。

多环芳香烃是可以在塑料，颜料，涂料和粘合剂找到, 是为杂质的。","Normally not manufactured intentionally but may occur as a constituent or impurity in other substances.

PAH can be found as impurity in plastic, pigment, paint and adhesive",N,N,N,N,Y,N,N,N,N,Y,Y,N,N,,Organic,Polycyclic Aromatic Hydrocarbons (PAHs) 
170,172,"4,4'-isopropylidenediphenol (Bisphenol A)","4,4'-对异丙基联苯酚
 (双酚A)",1/12/2017,201-245-8,80-05-7 ,"用于聚碳酸酯(PC)的生产;
用于其它聚合物的合成，如 聚酯碳酸酯， 聚丙烯酸酯， 聚砜，聚醚酰亚胺，多元醇， 聚酰胺 和苯并嗪树脂；
用于环氧树脂及其它树脂（如：乙烯基树脂，酚醛树脂和不饱和聚酯树脂）的生产；
作为添加剂用于应用在热敏纸的涂层中。","Used in manufacture of polycarbonates;
Used for the synthesis of other polymers such as polyester carbonate, polyarylates, polysulfones, polyetherimides, polyols, polyamides and polybenzoxazines;
Used in manufacture of epoxy resins and other resins, such as vinyl ester resins, phenolic plastic resins and unsaturated polyester resins;
Used as an additive in the coating applied to thermal paper.",N,N,N,N,Y,N,*Y,N,N,N,N,N,N,Coating in thermal paper for receipt,Organic,Bisphenol compounds
171,172,"Dibutylbis(pentane-2,4-dionato-O,O')tin","二丁基双(2,4-戊二酸根合-O,O')-(OC-6-11)-锡;双(乙酰丙酮酸)二丁基锡",6/25/2020,245-152-0,22673-19-4,本品主要用作室温硅橡胶固化催化剂，尤其是适用于脱醋酸型有机硅制品。还可用作聚氨酯涂料催化剂。,As a catalyst and as an additive in the production of plastics,N,N,N,N,Y,N,N,N,N,N,N,N,N,,Inorganic,Organotin compounds
172,173,Nonadecaflurodecanoic acid (PFDA) and its sodium and ammonium salts,全氟癸酸 (PFDA) 及其钠盐和铵盐,1/12/2017,"206-400-3,
-,
221-470-5","335-76-2,
3830-45-3,
3108-42-7","用作增塑剂，润滑剂，表面活性剂，润湿剂和阻蚀剂；
可存在于纳米喷雾和浸渍喷雾，户外纺织品，地毯，手套，纸质食品接触材料和雪蜡中。","Used as plasticiser, lubricant, surfactant, wetting agent and corrosion inhibitor;
Can be present in nanosprays and impregnation sprays, outdoor textiles, carpets, gloves, paper-based food contact materials and ski waxes.",Y*,Y*,Y*,N,Y,N,*Y,N,N,N,N,N,N,"Textiles and leather: only applicable to those with water/oil/stain repellent finishing.

Paper for FCM",Organic,Perfluorinated compounds
173,173,Dioctyltindilaurate (6CI);,二月桂酸二正辛基锡,1/20/2021,-,3648-18-8,本品主要用于食品、药品包装所用的PVC软薄膜、软管的加工。也作为硬质透明食品包装材料的润滑剂，用量在1.5质量份以下。还用作医用硅橡胶催化剂。,"This product is mainly used for processing PVC soft film and hose used for food and medicine packaging.It is also used as lubricant for hard and transparent food packaging materials, and the dosage is less than 1.5 quality parts.It is also used as a medical silicone rubber catalyst.",Y,Y,Y,N,Y,Y,Y,Y,Y,Y,Y,Y,Y,,Inorganic,Sn
174,174,"4-Heptylphenol,
branched and linear [substances with a linear and/or branched alkyl chain with a carbon number of 7 covalently bound predominantly in position 4 to phenol, covering also UVCB-and well-defined substances which include any of the individual isomers or a combination
thereof]","支链 和直链的4-庚基苯酚
 [含有线性或分支、碳原子数为7个、共价绑定在苯酚的4号位的烷基链的物质，包括UVCB物质以及任何含有独立或组合的界定明确的同分异构体的物质] ",1/12/2017, - , - ,从庚基苯酚衍生物派生出来的聚合物通常用于润滑添加剂。,"Polymers derived from phenol, heptyl derives are usually used in lubricant additives and greases in vehicles or machinery",N,N,N,N,N,N,N,N,N,N,N,N,N,,Organic,Alkylphenol compounds
175,175,"p-(1,1-dimethylpropyl)phenol",对叔戊基苯酚,1/12/2017,201-280-9,80-46-6,"用于香料和香精的生产；
作为单体用于聚合物（酚醛树脂）的生产；
用于胶黏剂，涂层，印刷油墨和油漆的配方和最终使用中。
","Used in the production of perfumes and fragrances;
Used as a monomer in the production of polymers (phenolic resins);
Used in formulation / end use of adhesives, coatings, printing inks and paints.
",N,N,N,N,Y,N,N,N,N,Y,Y,N,N,,Organic,Alkylphenol compounds
176,178,Perfluorohexane-1-sulphonic acid and its salts (PFHxS),全氟己基磺酸及其盐类 (PFHxS),7/7/2017, -, -,"可存在于地毯，皮革，服装，纺织品和家具装饰用品；
可存在于日常用品中（如，厨房用品，地板蜡，以及服装和鞋的防水喷雾）；
可存在于金属电镀，防火棉和电子设备中。

注释：PFHxS是全氟辛烷磺酸(PFOS)生产中的一种杂质。目前没有关于使用PFHxS的相关信息，但是它可存在于以上所提到的材料和产品中。","Can be presented in carpets, leather and apparel, textiles and upholstery;
Can be presented in household products (e.g. cookware, floor polish and water repellent sprays for apparel and footwear)
Can be presented in metal plating, paper, fire-fighting foam, and electronic equipment.

Remark: PFHxS is a known impurity in the production of PFOS. There is no available data on the use of PFHxS currently, and it can be presented in the materials and products above.",Y*,Y*,Y*,N,Y,N,Y,N,N,N,N,N,Y,Textiles and leather: only applicable to those with water/oil/stain repellent finishing,Organic,Perfluorinated compounds
177,179,"1,6,7,8,9,14,15,16,17,17,18,18-Dodecachloropentacyclo [12.2.1.16,9.02,13.05,10]octadeca-7,15-diene (“Dechlorane Plus”TM) [covering any of its individual anti- and syn-isomers or any combination thereof]",得克隆[包括所有反式和顺式异构体及其组合],1/15/2018, -, -,"用作模制或挤压电子电气应用，电缆中的非塑化阻燃剂；
用于胶黏剂，密封剂，爆炸品和粘合剂；
用于金属表面处理产品;
用于聚合物的制备和化合物。
","Used as a non-plasticizing flame retardant in moulded or extruded electrical/electronic applications, wires and cables;
Used in adhesives and sealants; explosives and binding agents;
Used in metal surface treatment products;
Used in polymer preparations and compounds.",N,N,N,Y,Y,N,N,N,N,N,Y,N,N,,Organic,Polyhalogenated alkanes
178,180,Cadmium nitrate,硝酸镉,1/15/2018,233-710-6,"10022-68-1
10325-94-7","用于实验室化学试剂和含镉混合物的配制；
用于玻璃，釉和陶瓷产品的生产；
用于塑胶，陶瓷，玻璃，橡胶，纸和油墨的颜料；
用作 PVC 稳定剂。","Used in laboratory chemicals and in formulations of cadmium containing mixtures;
Used in the manufacture of glass, porcelain and ceramic products;
Used in pigment for plastic, ceramic, glass, rubber, paper, ink;
Used as a PVC stabilizer.",N,N,N,Y,Y,N,Y,Y,Y,Y,N,N,N,,Inorganic,Cd compounds
179,180,Benz[a]anthracene,苯并[a]蒽,1/15/2018,200-286-6,"56-55-3
1718-53-2","此物质通常不是有意生产，而是作为其它物质的成分或杂质存在。
多环芳烃可作为杂质存在于塑胶，颜料，涂料和胶黏剂中。
","Normally not manufactured intentionally but may occur as a constituent or impurities in other substances.
This PAH can be found as impurities in plastic, pigment, paint and adhesive.",N,N,N,N,Y,N,N,N,N,Y,Y,N,N,,Organic,Polycyclic aromatic hydrocarbons (PAHs)
180,181,Cadmium carbonate,碳酸镉,1/15/2018,208-168-9,513-78-0,"用于化妆品和个人护理产品；
用于塑胶，陶瓷，玻璃和涂料的颜料；
用于电子，电气的电池，半导体；
用于pH调节剂和水处理产品；
用作中间体和实验室试剂。
","Used in cosmetics and personal care products;
Used in pigment for plastic, ceramic, glass, paint;
Used in electronics, electrical batteries, semi-conductors;
Used in pH regulators and water treatment products;
Used as an intermediate, laboratory agents;
Used as glass additives.",N,N,N,Y,Y,N,N,Y,Y,Y,N,Y,Y,,Inorganic,Cd compounds
181,181,Chrysene,䓛,1/15/2018,205-923-4,"218-01-9
1719-03-5","此物质通常不是有意生产，而是作为其它物质的成分或杂质存在。
多环芳烃可作为杂质存在于塑胶，颜料，涂料和胶黏剂中。
","Normally not manufactured intentionally but may occur as a constituent or impurities in other substances.
This PAH can be found as impurities in plastic, pigment, paint and adhesive.",N,N,N,N,Y,N,N,N,N,Y,Y,N,N,,Organic,Polycyclic aromatic hydrocarbons (PAHs)
182,182,Cadmium hydroxide,氢氧化镉,1/15/2018,244-168-5,21041-95-2,"用于实验室化学试剂；
用于生产化学品和电子电气和光学设备。
用于电池电极；
用于耐腐蚀和耐摩擦的金属涂层。
","Used in laboratory chemicals;
Used in the manufacture of chemicals and electrical, electronic and optical equipment.
Used in batteries electrodes;
Used in metal coating with anti-corrosion, friction, reduction.",N,N,N,Y,Y,N,N,Y,Y,N,N,Y,Y,,Inorganic,Cd compounds
183,183,Dicyclohexyl phthalate (DCHP) ,邻苯二甲酸二环己酯 (DCHP),6/27/2018,201-545-9,84-61-7,"用于生产塑料溶胶（密封剂和纺织品印刷）；
用于生产PVC,橡胶及塑料混合物（用作辅助增塑剂）；
作为阻遏剂和分散剂用于配制有机过氧化物。","Used in the manufacturing of plastisol (sealant compounds and textile printing);
Used in the manufacturing of compounds for PVC, rubber and plastic compounds (use as co-plasticizers); 
Used in the formulation of organic peroxide as phlegmatizer and dispersing agent.",Y*,Y*,N,N,Y ,N,N,N,N,Y ,Y ,N,N,Textiles with plastisol print,Organic,Phthalates
184,184,"Benzene-1,2,4-tricarboxylic acid 1,2-anhydride (trimellitic anhydride) (TMA)","1,2,4-苯三酸酐 (偏苯三甲酸酐) (TMA)",4/19/2018,209-008-0,552-30-7,"用于聚合物和酯类的生产；
用作实验室化学品。","Used in manufacture of polymers and esters;
Used as laboratory chemical.",N,N,N,N,Y,N,N,N,N,N,N,N,N,,Organic,Organic acid anhydride 
185,185,Benzo[ghi]perylene,"苯并(g,h,i)芘",6/27/2018,205-883-8,191-24-2 ,"此物质通常不是有意生产，而是作为其它物质的成分或杂质存在。
它是一种多环芳烃，可作为杂质存在于塑胶，颜料，涂料和胶黏剂中。","Normally not manufactured intentionally but may occur as a constituent or impurities in other substances;
This is a PAH and it can be found as impurities in plastic, pigment, paint and adhesive.",N,N,N,N,Y,N,N,N,N,Y,Y,N,N,,Organic,Polycyclic aromatic hydrocarbons (PAHs)
186,186,Ethylenediamine (EDA),乙二胺,6/27/2018,203-468-6,107-15-3,作为单体用于环氧树脂，PU，胶黏剂和其它聚合物,"Used as monomer in epoxy, PU, adhesives, coatings and other polymers.",N,N,N,N,Y,N,N,N,N,Y,Y,N,N,,Organic,Amine
187,187,Decamethylcyclopentasiloxane (D5),十甲基环五硅氧烷 (D5),6/27/2018,208-764-9,541-02-6,"用作生产硅酮聚合物的原料；
用于化妆品和个人护理产品，抛光剂和蜡，清洁洗涤产品，纺织品处理产品和染料中。","Used as a feedstock for the production of silicone polymers;
Used in cosmetics and personal care products, polishes and waxes, washing & cleaning products and textile treatment products and dyes.",Y,Y,N,N,Y,N,N,N,N,N,N,N,N,,Organic,Cyclomethicone
188,188,Octamethylcyclotetrasiloxane (D4),八甲基环四硅氧烷 (D4),6/27/2018,209-136-7,556-67-2,"此物质通常不是有意生产，而是作为其它物质的成分或杂质存在。
它是一种多环芳烃，可作为杂质存在于塑胶，颜料，涂料和胶黏剂中。","Used as a feedstock for the production of silicone polymers;
Used in washing and cleaning products, cosmetics, personal care products, polishes and waxes.",N,N,N,N,Y,N,N,N,N,N,N,N,N,,Organic,Cyclomethicone
189,189,Terphenyl hydrogenated,氢化三联苯,6/27/2018,262-967-7,61788-32-7 ,"用作塑胶应用中的添加剂
用于涂层/油墨，胶黏剂和密封剂的配制。","Used as additive in plastic applications;
Used in formulation of coatings/inks, adhesives and sealants.",N,N,N,N,Y,N,N,N,N,Y,Y,N,N,,Organic,Polyphenyls
